{
  "$schema": "https://json-schema.org/draft/2020-12/schema",
  "title": "Agent Effect Design Artifact",
  "type": "object",
  "additionalProperties": false,
  "required": [
    "artifact_type",
    "artifact_version",
    "analysis_artifact",
    "decision",
    "target_effect",
    "design_notes"
  ],
  "properties": {
    "artifact_type": {
      "type": "string",
      "const": "effect_design"
    },
    "artifact_version": {
      "type": "integer",
      "const": 1
    },
    "analysis_artifact": {
      "type": "string",
      "description": "Path or identifier of the transition analysis artifact that this design decision is based on."
    },
    "decision": {
      "type": "object",
      "additionalProperties": false,
      "required": [
        "action",
        "confidence"
      ],
      "properties": {
        "action": {
          "type": "string",
          "enum": [
            "reuse_existing_effect",
            "tune_existing_effect",
            "implement_new_effect"
          ]
        },
        "confidence": {
          "type": "number",
          "minimum": 0,
          "maximum": 1
        },
        "reason": {
          "type": "string"
        }
      }
    },
    "target_effect": {
      "type": "object",
      "additionalProperties": false,
      "required": [
        "family"
      ],
      "properties": {
        "family": {
          "type": "string"
        },
        "effect_id": {
          "type": "string"
        },
        "closest_existing_effect_id": {
          "type": "string"
        },
        "expected_runtime_shape": {
          "type": "string",
          "enum": [
            "single_pass_fullscreen",
            "multi_pass",
            "resource_backed",
            "unknown"
          ]
        }
      }
    },
    "evaluation_policy": {
      "type": "object",
      "additionalProperties": false,
      "properties": {
        "motion_topology": {
          "type": "object",
          "additionalProperties": false,
          "required": ["mode"],
          "properties": {
            "mode": {
              "type": "string",
              "enum": ["disabled", "advisory", "hard"],
              "description": "Optional design override for motion-topology scoring. Use disabled for non-segmented effects, advisory for useful but uncertain geometry evidence, and hard only when topology is a required deliverable characteristic."
            },
            "minimum_region_match_rate": {
              "type": "number",
              "minimum": 0,
              "maximum": 1
            },
            "minimum_direction_match_rate": {
              "type": "number",
              "minimum": 0,
              "maximum": 1
            }
          }
        },
        "selection": {
          "type": "object",
          "additionalProperties": false,
          "required": ["primary_metrics"],
          "properties": {
            "profile": {"type": "string"},
            "primary_metrics": {
              "type": "array",
              "minItems": 1,
              "items": {"type": "string", "enum": ["mse", "mae", "ssim", "motion_similarity", "peak_mse", "peak_ssim", "foreground_body_rotation_error", "foreground_body_scale_error", "foreground_body_translation_error", "foreground_body_pivot_error", "foreground_body_rotation_direction_agreement", "geometry_similarity"]}
            },
            "guardrail_metrics": {
              "type": "array",
              "items": {"type": "string", "enum": ["mse", "mae", "ssim", "motion_similarity", "peak_mse", "peak_ssim", "foreground_body_rotation_error", "foreground_body_scale_error", "foreground_body_translation_error", "foreground_body_pivot_error", "foreground_body_rotation_direction_agreement", "geometry_similarity"]}
            },
            "advisory_metrics": {
              "type": "array",
              "items": {"type": "string", "enum": ["mse", "mae", "ssim", "motion_similarity", "peak_mse", "peak_ssim", "foreground_body_rotation_error", "foreground_body_scale_error", "foreground_body_translation_error", "foreground_body_pivot_error", "foreground_body_rotation_direction_agreement", "geometry_similarity"]}
            }
          }
        }
      }
    },
    "design_notes": {
      "type": "object",
      "additionalProperties": false,
      "required": [
        "must_preserve",
        "approximations",
        "risks"
      ],
      "properties": {
        "must_preserve": {
          "type": "array",
          "items": {
            "type": "string"
          }
        },
        "approximations": {
          "type": "array",
          "items": {
            "type": "string"
          }
        },
        "risks": {
          "type": "array",
          "items": {
            "type": "string"
          }
        },
        "suggested_controls": {
          "type": "array",
          "items": {
            "type": "string"
          }
        }
      }
    },
    "implementation_seed": {
      "type": "object",
      "additionalProperties": false,
      "required": ["family", "required_shader_capabilities"],
      "properties": {
        "family": {"type": "string"},
        "template_effect_id": {"type": "string"},
        "required_shader_capabilities": {"type": "array", "items": {"type": "string"}}
      }
    },
    "source_variant": {
      "type": "object",
      "additionalProperties": false,
      "properties": {
        "base_stem": {"type": "string"},
        "source_files": {"type": "array", "items": {"type": "string"}},
        "replacements": {"type": "object", "additionalProperties": {"type": "string"}},
        "resource_folder": {"type": "string"},
        "resource_files": {"type": "array", "items": {"type": "string"}}
      }
    }
  }
}
